{
  "$schema": "https://json-schema.org/draft/2020-12/schema",
  "$id": "https://edison.watch/schemas/fleet-catalog-entry.json",
  "title": "Fleet catalog entry",
  "description": "How one fleet server advertises itself to the Edison marketplace. Each servers/<id>/catalog-entry.json is one entry; edison-watch's sync upserts these into scripts/marketplace_connectors.json. Keep in lockstep with the structural checks in aggregate.py and with edison-watch's index_entry()/server_file() in scripts/generate_marketplace_entries.py.",
  "type": "object",
  "additionalProperties": false,
  "required": [
    "id",
    "displayName",
    "description",
    "author",
    "category",
    "tags",
    "auth",
    "icon"
  ],
  "properties": {
    "id": {
      "type": "string",
      "pattern": "^[a-z0-9][a-z0-9-]*$",
      "description": "Stable connector id; must equal the server directory name and the icon basename."
    },
    "displayName": {
      "type": "string",
      "minLength": 1
    },
    "description": {
      "type": "string",
      "minLength": 1
    },
    "author": {
      "type": "string",
      "minLength": 1
    },
    "edison_hosted": {
      "type": "boolean",
      "description": "First-party server Edison itself hosts and operates. Drives the Edison-hosted badge. Omit or false for OSS/self-host-only servers."
    },
    "category": {
      "type": "string",
      "minLength": 1
    },
    "tags": {
      "type": "array",
      "items": {
        "type": "string",
        "minLength": 1
      },
      "minItems": 1
    },
    "transport": {
      "enum": [
        "http",
        "stdio"
      ],
      "description": "How edison-watch reaches the server. 'http' (default when omitted): a remote streamable-HTTP endpoint Edison hosts (requires 'url'). 'stdio': a local process the SealGate daemon spawns on the user's machine (requires 'command' + 'args', no 'url'); use for servers that must run client-side, e.g. wrapping a local CLI like adb."
    },
    "url": {
      "type": "string",
      "pattern": "^https://.+/mcp$",
      "description": "Public streamable-HTTP MCP endpoint. Ends in /mcp. Required for transport 'http'; forbidden for 'stdio'."
    },
    "command": {
      "type": "string",
      "minLength": 1,
      "description": "transport 'stdio' only: the executable the daemon spawns, e.g. 'npx' or 'uvx'. Must be on the user's PATH."
    },
    "args": {
      "type": "array",
      "items": {
        "type": "string"
      },
      "description": "transport 'stdio' only: argv passed to 'command', e.g. ['-y', '@sealgate/android-adb-mcp']. May be empty but the key is required for stdio."
    },
    "env": {
      "type": "object",
      "additionalProperties": {
        "type": "string"
      },
      "description": "transport 'stdio' only: extra environment for the spawned process. Values may contain {PLACEHOLDER} tokens resolved from template_fields.env at install."
    },
    "auth": {
      "enum": [
        "none",
        "token",
        "oauth",
        "edison-jwt"
      ],
      "description": "edison-watch mount auth mode. 'token' resolves {PLACEHOLDER}s from template_fields.env; 'oauth' is 401-discovered; 'none' is open; 'edison-jwt' means Edison mints a per-user JWT and injects it as Authorization (first-party servers only; requires edison_hosted). An edison-jwt entry may add its own user credential header via headers + template_fields (e.g. a bring-your-own bot token), never Authorization. The fleet server's bearer mode maps onto 'token'."
    },
    "headers": {
      "type": "object",
      "description": "Required when auth == 'token'; optional for 'edison-jwt' (a user credential beside the JWT, never Authorization). Values may contain {PLACEHOLDER} tokens resolved from template_fields.env.",
      "additionalProperties": {
        "type": "string"
      }
    },
    "template_fields": {
      "type": "object",
      "description": "Required when auth == 'token', and when an 'edison-jwt' entry declares headers. Install-time fields the user supplies.",
      "properties": {
        "env": {
          "type": "object",
          "additionalProperties": {
            "type": "object",
            "required": [
              "description"
            ],
            "properties": {
              "description": {
                "type": "string",
                "minLength": 1
              },
              "example": {
                "type": "string"
              }
            }
          }
        }
      }
    },
    "icon": {
      "type": "string",
      "pattern": "^[a-z0-9][a-z0-9-]*\\.svg$",
      "description": "Icon filename, co-located in this server directory; sync copies it into frontend-v2/public/marketplace/icons/."
    },
    "tools_configurations": {
      "type": "object",
      "description": "Reviewed per-tool ACL + lethal-trifecta defaults baked into the install. Keyed by the tool's native name as the server exposes it (e.g. 'reddit_scrape'). REQUIRED and non-empty when edison_hosted is true OR transport is 'stdio' (see allOf): every marketplace install skips autoconfig auto-labeling, so a tool with no config mounts at the protective default (write + read_private + read_untrusted + SECRET) and trips the lethal-trifecta guard on first call. An individual tool still omitted from a present map keeps that protective default, so partial drift fails closed. edison-watch's generate_marketplace_entries.py carries these into servers/<id>.json; servers_validate.py applies them at install.",
      "additionalProperties": {
        "type": "object",
        "additionalProperties": false,
        "required": [
          "write_operation",
          "read_private_data",
          "read_untrusted_public_data",
          "acl"
        ],
        "properties": {
          "write_operation": {
            "type": "boolean",
            "description": "True if the tool can modify external state (create/update/delete/send)."
          },
          "read_private_data": {
            "type": "boolean",
            "description": "True if the tool can read private/sensitive data (not just public content)."
          },
          "read_untrusted_public_data": {
            "type": "boolean",
            "description": "True if the tool reads untrusted external content (web, scraped pages, third-party APIs)."
          },
          "acl": {
            "enum": ["PUBLIC", "PRIVATE", "SECRET"],
            "description": "Sensitivity of the data this tool handles."
          }
        }
      }
    }
  },
  "allOf": [
    {
      "if": {
        "required": [
          "transport"
        ],
        "properties": {
          "transport": {
            "const": "stdio"
          }
        }
      },
      "then": {
        "required": [
          "command",
          "args",
          "tools_configurations"
        ],
        "not": {
          "required": [
            "url"
          ]
        },
        "properties": {
          "tools_configurations": {
            "minProperties": 1
          },
          "auth": {
            "enum": [
              "none",
              "token"
            ]
          },
          "edison_hosted": {
            "const": false
          }
        }
      },
      "else": {
        "required": [
          "url"
        ],
        "not": {
          "anyOf": [
            { "required": ["command"] },
            { "required": ["args"] },
            { "required": ["env"] }
          ]
        }
      }
    },
    {
      "if": {
        "required": [
          "auth"
        ],
        "properties": {
          "auth": {
            "const": "token"
          }
        }
      },
      "then": {
        "required": [
          "headers",
          "template_fields"
        ]
      }
    },
    {
      "if": {
        "required": [
          "auth"
        ],
        "properties": {
          "auth": {
            "const": "edison-jwt"
          }
        }
      },
      "then": {
        "required": [
          "edison_hosted"
        ],
        "dependentRequired": {
          "headers": [
            "template_fields"
          ],
          "template_fields": [
            "headers"
          ]
        },
        "properties": {
          "edison_hosted": {
            "const": true
          },
          "headers": {
            "propertyNames": {
              "not": {
                "pattern": "^[Aa][Uu][Tt][Hh][Oo][Rr][Ii][Zz][Aa][Tt][Ii][Oo][Nn]$"
              }
            }
          }
        }
      }
    },
    {
      "if": {
        "required": [
          "edison_hosted"
        ],
        "properties": {
          "edison_hosted": {
            "const": true
          }
        }
      },
      "then": {
        "required": [
          "tools_configurations"
        ],
        "properties": {
          "tools_configurations": {
            "minProperties": 1
          }
        }
      }
    }
  ]
}
