{
  "id": "image-host",
  "displayName": "Image Host",
  "description": "Turn an image into a public, non-expiring URL you can paste into a GitHub issue, Markdown, or chat. Send base64, get back a URL.",
  "author": "SealGate",
  "edison_hosted": true,
  "category": "development",
  "tags": [
    "image",
    "hosting",
    "screenshots",
    "upload",
    "sealgate"
  ],
  "url": "https://image-host.sealgate.ai/mcp",
  "auth": "edison-jwt",
  "icon": "image-host.svg",
  "tools_configurations": {
    "upload_image": {
      "write_operation": true,
      "read_private_data": false,
      "read_untrusted_public_data": false,
      "acl": "PUBLIC"
    },
    "delete_image": {
      "write_operation": true,
      "read_private_data": false,
      "read_untrusted_public_data": false,
      "acl": "PUBLIC"
    }
  }
}
