{
  "id": "linkedin-scraper",
  "displayName": "LinkedIn Scraper",
  "description": "Search and scrape public LinkedIn data: posts (by keyword or profile/company URL), people (by query and filters like job title, company, location), and company pages (headcount, industry, activity). Returns structured results. No LinkedIn account required.",
  "author": "SealGate",
  "edison_hosted": true,
  "category": "data",
  "tags": [
    "linkedin",
    "social",
    "web-scraping",
    "search",
    "posts",
    "profiles",
    "people",
    "companies",
    "apify"
  ],
  "url": "https://linkedin.sealgate.ai/mcp",
  "auth": "edison-jwt",
  "icon": "linkedin-scraper.svg",
  "tools_configurations": {
    "linkedin_scrape": {
      "write_operation": false,
      "read_private_data": false,
      "read_untrusted_public_data": true,
      "acl": "PUBLIC"
    },
    "linkedin_profile_search": {
      "write_operation": false,
      "read_private_data": false,
      "read_untrusted_public_data": true,
      "acl": "PUBLIC"
    },
    "linkedin_company": {
      "write_operation": false,
      "read_private_data": false,
      "read_untrusted_public_data": true,
      "acl": "PUBLIC"
    }
  }
}
