{
  "id": "x",
  "displayName": "X (Twitter) Scraper",
  "description": "Search and scrape X (formerly Twitter) tweets, profiles, searches, and lists. Query by term (X advanced-search syntax supported) or point it at X/Twitter URLs; returns structured results.",
  "author": "SealGate",
  "edison_hosted": true,
  "category": "data",
  "tags": [
    "x",
    "twitter",
    "social",
    "web-scraping",
    "search",
    "apify"
  ],
  "url": "https://x.sealgate.ai/mcp",
  "auth": "edison-jwt",
  "icon": "x.svg",
  "tools_configurations": {
    "x_scrape": {
      "write_operation": false,
      "read_private_data": false,
      "read_untrusted_public_data": true,
      "acl": "PUBLIC"
    }
  }
}
