{
  "id": "reddit",
  "displayName": "Reddit Scraper",
  "description": "Search and scrape Reddit posts, comments, communities, and users. Query by term (optionally scoped to a subreddit) or point it at Reddit URLs; returns structured results.",
  "author": "SealGate",
  "edison_hosted": true,
  "category": "data",
  "tags": [
    "reddit",
    "social",
    "web-scraping",
    "search",
    "apify"
  ],
  "url": "https://reddit.sealgate.ai/mcp",
  "auth": "edison-jwt",
  "icon": "reddit.svg",
  "tools_configurations": {
    "reddit_scrape": {
      "write_operation": false,
      "read_private_data": false,
      "read_untrusted_public_data": true,
      "acl": "PUBLIC"
    }
  }
}
